{
  "schema_version": 1,
  "writer": "macos-mbr-last",
  "device_path": "/dev/disk4",
  "target": {
    "display_name": "SanDisk 3.2Gen1",
    "bytes": 30784094208
  },
  "preflight_at": "2026-10-21T17:44:25Z",
  "completed_at": "2026-10-21T18:36:54Z",
  "readback": {
    "method": "mbr-last-raw-compare",
    "status": "passed"
  },
  "event_id": "20261022024140-jeonghan-home-570e8e43",
  "generation_id": "20261022024140-jeonghan-home",
  "repository_revision": "63cd0f4cc0a71311ed239fdfdfe8f3315135f2f6",
  "catalog_tree": "da76b69ad34e5937cb9bb35a83879573478bb7fb"
}
