{
  "schema_version": 1,
  "writer": "macos-mbr-last",
  "device_path": "/dev/disk4",
  "target": {
    "display_name": "ProductCode",
    "bytes": 15833497600
  },
  "preflight_at": "2026-10-17T00:38:21Z",
  "completed_at": "2026-10-17T01:32:06Z",
  "readback": {
    "method": "mbr-last-raw-compare",
    "status": "passed"
  },
  "event_id": "20261017093655-jeonghan-home-3f847ad3",
  "generation_id": "20261017093655-jeonghan-home",
  "repository_revision": "4b93a34119bad5a4915e8055bf7123b7f98869fd",
  "catalog_tree": "b2f8699f01dd6dd391c6b9b2d8ce13498f8c9911"
}
